{
  "schema_version":"1.0.0","algorithm_id":"bag-piglet","name":"BAG-Piglet","full_name":"Piglet with Block Errors and Augmented Gabidulin Codes","version":null,"function":"key_encapsulation","submission_path":"KeyEncapsulation/BAG-Piglet",
  "overview_classification":{"family":"code_based","family_label_zh":"编码密码","family_report_label":"编码密码","subcategory":"rank_metric","subcategory_label_zh":"基于秩距离","subcategory_report_label":"基于秩距离"},
  "technical_classification":{"hardness_problems":[{"name":"pairwise block rank decoding","role":"primary","notes":"Unstructured/ideal rank-metric decoding with disjoint block supports."},{"name":"pairwise block ideal rank support learning","role":"secondary","notes":"Used for structured-key security analysis."}],"mathematical_structure":"ideal codes over F_(2^m), disjoint block rank errors, augmented Gabidulin auxiliary code","underlying_pke":"BAG-Piglet.PKE","kem_construction":"salted Fujisaki-Okamoto transform","claimed_security_target":"IND-CCA2; 128/256/384/512-bit classical targets","security_models":["ROM"]},
  "affiliations":[{"affiliation_id":"aff-iie-cas","name_en":"Institute of Information Engineering, Chinese Academy of Sciences","name_zh":"中国科学院信息工程研究所"},{"affiliation_id":"aff-huawei","name_en":"Huawei Technologies Co., Ltd.","name_zh":"华为技术有限公司"}],
  "submitters":[{"name_en":"Li-Ping Wang","name_zh":"王丽萍","affiliation_ids":["aff-iie-cas"],"roles":["submitter"]},{"name_en":"Yi Tang","name_zh":"唐毅","affiliation_ids":["aff-huawei"],"roles":["submitter"]},{"name_en":"Haofei Wang","name_zh":"王浩飞","affiliation_ids":["aff-iie-cas"],"roles":["submitter"]},{"name_en":"Lingqing Zhao","name_zh":"赵凌青","affiliation_ids":["aff-iie-cas"],"roles":["submitter","contact"]}],
  "common_parameters":{"ring":"R=F_(2^m)[X]/(P(X))","field":"F_(2^m)","code_structure":"ideal rank-metric code with augmented Gabidulin code G+(n*n1,n',k,m)","isogeny_structure":null,"noise_or_error_distribution":"disjoint block errors with specified rank-weight vectors","modulus":2,"dimensions":{"n":"parameter-set-specific","m":"extension degree","n1":2},"weights":{"w_xy":"three-block secret rank vector","w_r1_R2_e":"four-block encryption-error rank vector"},"error_correction":"augmented Gabidulin decoding","symmetric_primitives":["SHAKE256","SHA3-512","OpenSSL randombytes"],"representation":"finite-field vectors; seeded secret key","other":{"public_key_dimension":"2-dimensional vector"}},
  "parameter_sets":[
    {"name":"BAG-Piglet-128","implementation_aliases":["bag_piglet128"],"submission_security_label":"128-bit classical","claimed_classical_security_bits":128,"claimed_quantum_security_bits":80,"core_parameters":{"q":2,"n":47,"n_prime":43,"m":43,"n1":2,"epsilon":30,"k":3,"w_xy":[4,4,4],"w_r1_R2_e":[2,3,3,3],"P":"X^43+X^6+X^4+X^3+1","f":"X^47+X^5+1"},"decapsulation_failure_probability":"2^-130","sizes":{"public_key":{"bytes":522,"raw":"522 bytes","basis":"specification Table 3"},"secret_key":{"bytes":16,"raw":"seed/ss key 16 bytes","basis":"specification Table 3"},"ciphertext":{"bytes":1011,"raw":"1011 bytes","basis":"specification Table 3"},"shared_secret":{"bytes":16,"raw":"16 bytes","basis":"specification Table 3"}},"source_refs":["spec"],"issues":[]},
    {"name":"BAG-Piglet-256","implementation_aliases":["bag_piglet256"],"submission_security_label":"256-bit classical","claimed_classical_security_bits":256,"claimed_quantum_security_bits":128,"core_parameters":{"q":2,"n":78,"n_prime":78,"m":79,"n1":2,"epsilon":54,"k":4,"w_xy":[6,6,6],"w_r1_R2_e":[3,3,4,4],"P":"X^78+X^6+X^5+X^3+1","f":"X^79+X^9+1"},"decapsulation_failure_probability":"2^-273","sizes":{"public_key":{"bytes":1573,"raw":"1573 bytes","basis":"specification Table 3"},"secret_key":{"bytes":32,"raw":"seed/ss key 32 bytes","basis":"specification Table 3"},"ciphertext":{"bytes":3081,"raw":"3081 bytes","basis":"specification Table 3"},"shared_secret":{"bytes":32,"raw":"32 bytes","basis":"specification Table 3"}},"source_refs":["spec"],"issues":[]},
    {"name":"BAG-Piglet-384","implementation_aliases":["bag_piglet384"],"submission_security_label":"384-bit classical","claimed_classical_security_bits":384,"claimed_quantum_security_bits":192,"core_parameters":{"q":2,"n":106,"n_prime":103,"m":103,"n1":2,"epsilon":77,"k":4,"w_xy":[7,7,7],"w_r1_R2_e":[4,4,4,4],"P":"X^106+X^15+1","f":"X^103+X^9+1"},"decapsulation_failure_probability":"2^-394","sizes":{"public_key":{"bytes":2778,"raw":"2778 bytes","basis":"specification Table 3"},"secret_key":{"bytes":48,"raw":"seed/ss key 48 bytes","basis":"specification Table 3"},"ciphertext":{"bytes":5459,"raw":"5459 bytes","basis":"specification Table 3"},"shared_secret":{"bytes":48,"raw":"48 bytes","basis":"specification Table 3"}},"source_refs":["spec"],"issues":[]},
    {"name":"BAG-Piglet-512","implementation_aliases":["bag_piglet512"],"submission_security_label":"512-bit classical","claimed_classical_security_bits":512,"claimed_quantum_security_bits":256,"core_parameters":{"q":2,"n":125,"n_prime":130,"m":131,"n1":2,"epsilon":92,"k":4,"w_xy":[8,8,8],"w_r1_R2_e":[4,4,5,5],"P":"X^125+X^7+X^6+X^5+1","f":"X^131+X^8+X^3+X^2+1"},"decapsulation_failure_probability":"2^-520","sizes":{"public_key":{"bytes":4158,"raw":"4158 bytes","basis":"specification Table 3"},"secret_key":{"bytes":64,"raw":"seed/ss key 64 bytes","basis":"specification Table 3"},"ciphertext":{"bytes":8188,"raw":"8188 bytes","basis":"specification Table 3"},"shared_secret":{"bytes":64,"raw":"64 bytes","basis":"specification Table 3"}},"source_refs":["spec"],"issues":[]}
  ],
  "submission_claims":{"claimed_advantages":[{"category":"compactness","summary":"Multiple syndromes, augmented Gabidulin codes and disjoint-support errors are claimed to reduce parameters and ciphertext size.","claim_strength":"comparative","comparison_scope":"Piglet-1, RQC and RQC-Block-MS-AG","source_refs":["spec"]},{"category":"simplicity","summary":"Replacing a 2-dimensional public-key matrix with a 2-dimensional vector is claimed to reduce structural complexity.","claim_strength":"comparative","comparison_scope":"Piglet-1","source_refs":["spec"]},{"category":"performance","summary":"Finite-field multiplications are claimed reduced from 18 to 12.","claim_strength":"quantified","comparison_scope":"Piglet-1","source_refs":["spec"]},{"category":"flexibility","summary":"Block partitioning and modular decoding allow parameter tuning and extension to other rank-metric families.","claim_strength":"qualitative","comparison_scope":null,"source_refs":["spec"]}],"limitations_and_constraints":[{"type":"explicit_in_submission","summary":"All four parameter sets have nonzero DFR.","source_refs":["spec"]},{"type":"derived_from_implementation_description","summary":"Submitted C++ implementation depends on NTL 11.x and OpenSSL in a Linux/Makefile environment.","source_refs":["spec"]},{"type":"derived_from_test_setup","summary":"Performance figures are averages over 1000 random instances.","source_refs":["spec"]}]},
  "independent_assessment":{"status":"not_started","findings":[]},"implementations":[{"name":"Reference_Implementation","language":"C++","platform":"Linux with NTL/OpenSSL","path":"KeyEncapsulation/BAG-Piglet/Implementations/Reference_Implementation"},{"name":"Optimized_Implementation","language":"C++","platform":"Linux with NTL/OpenSSL","path":"KeyEncapsulation/BAG-Piglet/Implementations/Optimized_Implementation"}],"submission_completeness":{"basic_information":true,"specification":true,"implementation":true,"test_vectors":true},
  "sources":[{"source_id":"basic","type":"basic_information","path":"KeyEncapsulation/BAG-Piglet/Basic information/Basic information.pdf","priority":1,"notes":"Scanned form; OCR and visual review used."},{"source_id":"spec","type":"specification","path":"KeyEncapsulation/BAG-Piglet/Algorithm specifications/Algorithm specifications.pdf","priority":2,"notes":null}],
  "evidence":[{"field":"submitters, affiliations","source_id":"basic","locator":"PDF pp.1-2","summary":"Basic form lists four submitters and identifies Lingqing Zhao as contact.","confidence":"high"},{"field":"overview_classification, technical_classification","source_id":"spec","locator":"PDF pp.3,5-8,10-12","summary":"Specification defines rank metric, block/ideal assumptions, AG code and salted FO.","confidence":"high"},{"field":"parameter_sets","source_id":"spec","locator":"PDF p.8, Tables 1-3; p.21, Table 5","summary":"Parameters, sizes and DFR are tabulated.","confidence":"high"},{"field":"submission_claims","source_id":"spec","locator":"PDF pp.22-24","summary":"Feature section states compactness, simplicity, flexibility and multiplication-count claims.","confidence":"high"}],
  "review":{"extraction_status":"complete","confidence":"high","cross_reviewed":false,"review_notes":["Formal parameter names and implementation aliases matched across Tables 1-3 and directory names."]},"issues":[{"severity":"missing","code":"version_not_stated","message":"No explicit version string located.","field":"version"}]
}
