{
  "schema_version":"1.0.0","algorithm_id":"c-multi-ur-ag","name":"C-Multi-UR-AG","full_name":"Compact Multi-UR-AG","version":null,"function":"key_encapsulation","submission_path":"KeyEncapsulation/C-Multi-UR-AG",
  "overview_classification":{"family":"code_based","family_label_zh":"编码密码","family_report_label":"编码密码","subcategory":"rank_metric","subcategory_label_zh":"基于秩距离","subcategory_report_label":"基于秩距离"},
  "technical_classification":{"hardness_problems":[{"name":"rank syndrome decoding (RSD)","role":"primary","notes":"Random unstructured rank-decoding basis."},{"name":"rank support learning (RSL)","role":"primary","notes":"Multiple-syndrome unstructured assumption."}],"mathematical_structure":"Unstructured F_(2^m)-linear rank-metric codes with augmented Gabidulin auxiliary code and multiple syndromes","underlying_pke":"C-Multi-UR-AG.PKE","kem_construction":"salted Fujisaki-Okamoto transform","claimed_security_target":"IND-CCA2; 128/256/512-bit classical categories","security_models":["ROM","QROM"]},
  "affiliations":[{"affiliation_id":"aff-nuaa","name_en":"Nanjing University of Aeronautics and Astronautics","name_zh":"南京航空航天大学"},{"affiliation_id":"aff-nudt","name_en":"National University of Defense Technology","name_zh":"国防科技大学"},{"affiliation_id":"aff-sklc","name_en":"State Key Laboratory of Cryptology","name_zh":"密码科学技术国家重点实验室"},{"affiliation_id":"aff-whu","name_en":"Wuhan University","name_zh":"武汉大学"},{"affiliation_id":"aff-xdu","name_en":"Xidian University","name_zh":"西安电子科技大学"},{"affiliation_id":"aff-jnu","name_en":"Jinan University","name_zh":"暨南大学"}],
  "submitters":[{"name_en":"Yongcheng Song","name_zh":"宋永成","affiliation_ids":["aff-nuaa"],"roles":["submitter","contact"]},{"name_en":"Xinyi Huang","name_zh":"黄欣沂","affiliation_ids":["aff-nuaa"],"roles":["submitter"]},{"name_en":"Rongmao Chen","name_zh":"陈荣茂","affiliation_ids":["aff-nudt"],"roles":["submitter"]},{"name_en":"Jiang Zhang","name_zh":"张江","affiliation_ids":["aff-sklc"],"roles":["submitter"]},{"name_en":"Debiao He","name_zh":"何德彪","affiliation_ids":["aff-whu"],"roles":["submitter"]},{"name_en":"Xiaofeng Chen","name_zh":"陈晓峰","affiliation_ids":["aff-xdu"],"roles":["submitter"]},{"name_en":"Junzuo Lai","name_zh":"赖俊佐","affiliation_ids":["aff-jnu"],"roles":["submitter"]},{"name_en":"Yi Wang","name_zh":"王毅","affiliation_ids":["aff-nudt"],"roles":["submitter"]},{"name_en":"Chao Lin","name_zh":"林超","affiliation_ids":["aff-nuaa"],"roles":["submitter"]},{"name_en":"Jiang Tan","name_zh":"谭疆","affiliation_ids":["aff-nudt"],"roles":["submitter"]},{"name_en":"Kang Lin","name_zh":"林康","affiliation_ids":["aff-nudt"],"roles":["submitter"]}],
  "common_parameters":{"ring":null,"field":"F_(2^m)","code_structure":"unstructured rank-metric linear code with augmented Gabidulin code and N1/N2 multiple syndromes","isogeny_structure":null,"noise_or_error_distribution":"uniform low-rank vectors/matrices with specified weights w1,w2","modulus":2,"dimensions":{"m":"extension degree","n":"rank-code dimension","t":"generator support dimension","k":"message dimension","N1":"public syndrome count","N2":"ciphertext syndrome count"},"weights":{"w1":"secret/error rank weight","w2":"encryption rank weight"},"error_correction":{"code":"augmented Gabidulin","decoder":"Welch-Berlekamp-like","radius":"r"},"symmetric_primitives":["NGCC SM3 DRBG","SM3/HMAC-SM3 pseudohash with 64-byte output"],"representation":"seed-expanded unstructured matrices and finite-field elements","other":{"hash_query_bound":"2^64"}},
  "parameter_sets":[
    {"name":"Level-128","implementation_aliases":["CMultiURAG-128"],"submission_security_label":"128-bit classical / 80-bit quantum target","claimed_classical_security_bits":170,"claimed_quantum_security_bits":85,"core_parameters":{"q":2,"m":79,"n":35,"t":79,"k":3,"N1":11,"N2":16,"w1":8,"w2":9,"r":72},"decapsulation_failure_probability":"2^-148","sizes":{"public_key":{"bytes":3866,"raw":"3866 bytes","basis":"specification Table 3"},"secret_key":{"bytes":94,"raw":"94 bytes","basis":"specification Table 3"},"ciphertext":{"bytes":7332,"raw":"7332 bytes","basis":"specification Table 3"},"shared_secret":{"bytes":64,"raw":"64 bytes","basis":"specification Table 3"}},"source_refs":["spec"],"issues":[]},
    {"name":"Level-256","implementation_aliases":["CMultiURAG-256"],"submission_security_label":"256-bit classical / 128-bit quantum target","claimed_classical_security_bits":276,"claimed_quantum_security_bits":138,"core_parameters":{"q":2,"m":127,"n":45,"t":127,"k":3,"N1":15,"N2":16,"w1":10,"w2":11,"r":110},"decapsulation_failure_probability":"2^-268","sizes":{"public_key":{"bytes":10780,"raw":"10780 bytes","basis":"specification Table 3"},"secret_key":{"bytes":112,"raw":"112 bytes","basis":"specification Table 3"},"ciphertext":{"bytes":15304,"raw":"15304 bytes","basis":"specification Table 3"},"shared_secret":{"bytes":64,"raw":"64 bytes","basis":"specification Table 3"}},"source_refs":["spec"],"issues":[]},
    {"name":"Level-512","implementation_aliases":["CMultiURAG-512"],"submission_security_label":"512-bit classical / 256-bit quantum target","claimed_classical_security_bits":530,"claimed_quantum_security_bits":265,"core_parameters":{"q":2,"m":181,"n":67,"t":181,"k":4,"N1":19,"N2":21,"w1":12,"w2":14,"r":168},"decapsulation_failure_probability":"2^-598","sizes":{"public_key":{"bytes":28866,"raw":"28866 bytes","basis":"specification Table 3"},"secret_key":{"bytes":155,"raw":"155 bytes","basis":"specification Table 3"},"ciphertext":{"bytes":40926,"raw":"40926 bytes","basis":"specification Table 3"},"shared_secret":{"bytes":64,"raw":"64 bytes","basis":"specification Table 3"}},"source_refs":["spec"],"issues":[]}
  ],
  "submission_claims":{"claimed_advantages":[{"category":"security","summary":"Security is claimed to rest entirely on random unstructured rank-decoding problems.","claim_strength":"qualitative","comparison_scope":"Structured rank-code systems","source_refs":["spec"]},{"category":"compactness","summary":"Submission claims small bandwidth among unstructured code- and lattice-based KEMs.","claim_strength":"comparative","comparison_scope":"FrodoKEM, Scloud+ and unstructured code KEMs","source_refs":["spec"]},{"category":"performance","summary":"WBL decoding is claimed to make augmented Gabidulin decoding efficient with precise DFR.","claim_strength":"qualitative","comparison_scope":"Original Multi-UR-AG","source_refs":["spec"]}],"limitations_and_constraints":[{"type":"explicit_caveat","summary":"Rank-metric cryptography remains comparatively young and needs continuing analysis.","source_refs":["spec"]},{"type":"explicit_caveat","summary":"Augmented Gabidulin decoding is recent and should be improved further for cryptosystem efficiency.","source_refs":["spec"]},{"type":"derived_from_test_setup","summary":"Benchmarks use WSL2 Ubuntu 26.04 on one Intel Core Ultra 9 275HX performance core.","source_refs":["spec"]},{"type":"explicit_in_submission","summary":"All sets have nonzero parameter-dependent DFR.","source_refs":["spec"]}]},
  "independent_assessment":{"status":"not_started","findings":[]},"implementations":[{"name":"Reference_Implementation","language":"C/C++","platform":"WSL2/Linux","path":"KeyEncapsulation/C-Multi-UR-AG/Implementations/Reference_Implementation"},{"name":"Optimized_Implementation","language":"C/C++","platform":"x86-64 AVX2/AVX-VNNI","path":"KeyEncapsulation/C-Multi-UR-AG/Implementations/Optimized_Implementation"}],"submission_completeness":{"basic_information":true,"specification":true,"implementation":true,"test_vectors":true},
  "sources":[{"source_id":"basic","type":"basic_information","path":"KeyEncapsulation/C-Multi-UR-AG/Basic information/C-Multi-UR-AG-Basic Algorithm Information.pdf","priority":1,"notes":"Scanned form; contacts excluded."},{"source_id":"spec","type":"specification","path":"KeyEncapsulation/C-Multi-UR-AG/Algorithm specifications/C-Multi-UR-AG-Documentation.pdf","priority":2,"notes":null}],
  "evidence":[{"field":"submitters, affiliations","source_id":"basic","locator":"PDF pp.1-3","summary":"Basic form lists 11 submitters and contact Yongcheng Song.","confidence":"high"},{"field":"overview_classification, technical_classification","source_id":"spec","locator":"PDF pp.1,3-7,12-15","summary":"Specification identifies unstructured rank metric, RSD/RSL, AG code and salted FO.","confidence":"high"},{"field":"parameter_sets","source_id":"spec","locator":"PDF p.14, Tables 2-3","summary":"Core parameters, sizes, DFR and security estimates are tabulated.","confidence":"high"},{"field":"submission_claims","source_id":"spec","locator":"PDF pp.29-30","summary":"Advantages and limitations are explicitly listed.","confidence":"high"}],
  "review":{"extraction_status":"complete","confidence":"high","cross_reviewed":false,"review_notes":["Security-bit fields use reported attack complexity values; target labels preserve category claims."]},"issues":[{"severity":"missing","code":"version_not_stated","message":"No explicit version string located.","field":"version"}]
}
