{
  "schema_version":"1.0.0","algorithm_id":"compass-kem","name":"COMPASS-KEM","full_name":"COMpact Post-quAntum Security Suite Key Encapsulation Mechanism","version":"1.2","function":"key_encapsulation","submission_path":"KeyEncapsulation/COMPASS-KEM",
  "overview_classification":{"family":"lattice_based","family_label_zh":"格密码","family_report_label":"格密码","subcategory":"lwe_rlwe_based","subcategory_label_zh":"基于MLWE/RLWE","subcategory_report_label":"基于MLWE/RLWE"},
  "technical_classification":{"hardness_problems":[{"name":"Module Learning With Rounding (MLWR) over prime moduli","role":"primary","notes":"Decisional MLWR."},{"name":"biased MLWR","role":"primary","notes":"Variant introduced for the KEM proof, reduced from MLWE."},{"name":"Module Learning With Errors (MLWE)","role":"secondary","notes":"Worst-case foundation used in reductions."}],"mathematical_structure":"R_q=Z_q[X]/(X^n+1), module matrices/vectors and NTT arithmetic over prime q","underlying_pke":"COMPASS-PKE","kem_construction":"QFO transform with implicit rejection","claimed_security_target":"IND-CCA in classical and quantum random-oracle models; 128/256/384/512 classical categories","security_models":["ROM","QROM"]},
  "affiliations":[{"affiliation_id":"aff-sjtu","name_en":"Shanghai Jiao Tong University","name_zh":"上海交通大学"},{"affiliation_id":"aff-zhixun","name_en":"Zhixun Crypto (Shanghai) Testing and Evaluation Technology Co., Ltd.","name_zh":"知迅密码（上海）检测技术有限公司"}],
  "submitters":[{"name_en":"Geng Wang","name_zh":"王庚","affiliation_ids":["aff-sjtu"],"roles":["submitter","contact"]},{"name_en":"Zhedong Wang","name_zh":"王哲东","affiliation_ids":["aff-sjtu"],"roles":["submitter"]},{"name_en":"Wenwen Xia","name_zh":"夏雯雯","affiliation_ids":["aff-sjtu"],"roles":["submitter"]},{"name_en":"Ningyue Zhang","name_zh":"张宁悦","affiliation_ids":["aff-sjtu"],"roles":["submitter"]},{"name_en":"Wenyu He","name_zh":"何文宇","affiliation_ids":["aff-sjtu"],"roles":["submitter"]},{"name_en":"Xinyang Geng","name_zh":"耿新阳","affiliation_ids":["aff-sjtu"],"roles":["submitter"]},{"name_en":"Fei Duan","name_zh":"段飞","affiliation_ids":["aff-sjtu"],"roles":["submitter"]},{"name_en":"Weidan Ji","name_zh":"纪伟丹","affiliation_ids":["aff-sjtu"],"roles":["submitter"]},{"name_en":"Jihong Li","name_zh":"李继红","affiliation_ids":["aff-zhixun"],"roles":["submitter"]}],
  "common_parameters":{"ring":"Z_q[X]/(X^n+1)","field":null,"code_structure":null,"isogeny_structure":null,"noise_or_error_distribution":"centered binomial secrets/randomness D_eta; rounding/compression errors replace explicit MLWE public errors","modulus":"3329 or 7681","dimensions":{"n":[256,512],"module_dimensions":"k x l"},"weights":null,"error_correction":"coefficient-wise high-bit message encoding and compression-noise tolerance","symmetric_primitives":["domain-separated hash/XOF/KDF from approved secure hash standard"],"representation":"NTT-domain polynomials and compressed public-key/ciphertext coefficients","other":{"p":[832,1920],"compression":"d=d1=2, d2 in {6,8}"}},
  "parameter_sets":[
    {"name":"COMPASS-KEM-128","implementation_aliases":["Level 1"],"submission_security_label":"128-bit classical / 80-bit quantum","claimed_classical_security_bits":128,"claimed_quantum_security_bits":80,"core_parameters":{"n":256,"q":3329,"p":832,"k":2,"l":2,"eta_s":3,"d":2,"d1":2,"d2":8},"decapsulation_failure_probability":"2^-189.27","sizes":{"public_key":{"bytes":672,"raw":"672 bytes","basis":"specification Table 2"},"secret_key":{"bytes":1504,"raw":"1504 bytes","basis":"specification Table 2"},"ciphertext":{"bytes":768,"raw":"768 bytes","basis":"specification Table 2"},"shared_secret":{"bytes":32,"raw":"n/8 = 32 bytes","basis":"KEM pseudocode"}},"source_refs":["spec"],"issues":[]},
    {"name":"COMPASS-KEM-256","implementation_aliases":["Level 2"],"submission_security_label":"256-bit classical / 128-bit quantum","claimed_classical_security_bits":256,"claimed_quantum_security_bits":128,"core_parameters":{"n":256,"q":3329,"p":832,"k":4,"l":4,"eta_s":2,"d":2,"d1":2,"d2":6},"decapsulation_failure_probability":"2^-181.13","sizes":{"public_key":{"bytes":1312,"raw":"1312 bytes","basis":"specification Table 2"},"secret_key":{"bytes":2912,"raw":"2912 bytes","basis":"specification Table 2"},"ciphertext":{"bytes":1472,"raw":"1472 bytes","basis":"specification Table 2"},"shared_secret":{"bytes":32,"raw":"n/8 = 32 bytes","basis":"KEM pseudocode"}},"source_refs":["spec"],"issues":[]},
    {"name":"COMPASS-KEM-384","implementation_aliases":["Level 3"],"submission_security_label":"384-bit classical / 192-bit quantum","claimed_classical_security_bits":384,"claimed_quantum_security_bits":192,"core_parameters":{"n":512,"q":7681,"p":1920,"k":3,"l":3,"eta_s":3,"d":2,"d1":2,"d2":8},"decapsulation_failure_probability":"2^-404.51","sizes":{"public_key":{"bytes":2144,"raw":"2144 bytes","basis":"specification Table 2"},"secret_key":{"bytes":4704,"raw":"4704 bytes","basis":"specification Table 2"},"ciphertext":{"bytes":2432,"raw":"2432 bytes","basis":"specification Table 2"},"shared_secret":{"bytes":64,"raw":"n/8 = 64 bytes","basis":"KEM pseudocode"}},"source_refs":["spec"],"issues":[]},
    {"name":"COMPASS-KEM-512","implementation_aliases":["Level 4"],"submission_security_label":"512-bit classical / 256-bit quantum","claimed_classical_security_bits":512,"claimed_quantum_security_bits":256,"core_parameters":{"n":512,"q":7681,"p":1920,"k":4,"l":4,"eta_s":4,"d":2,"d1":2,"d2":6},"decapsulation_failure_probability":"2^-250.31","sizes":{"public_key":{"bytes":2848,"raw":"2848 bytes","basis":"specification Table 2"},"secret_key":{"bytes":6240,"raw":"6240 bytes","basis":"specification Table 2"},"ciphertext":{"bytes":3264,"raw":"3264 bytes","basis":"specification Table 2"},"shared_secret":{"bytes":64,"raw":"n/8 = 64 bytes","basis":"KEM pseudocode"}},"source_refs":["spec"],"issues":[]}
  ],
  "submission_claims":{"claimed_advantages":[{"category":"security","summary":"Prime-modulus MLWR and biased-MLWR are claimed reducible from MLWE, repairing the cited Saber proof issue.","claim_strength":"qualitative","comparison_scope":"Power-of-two-modulus MLWR/Saber proof","source_refs":["spec"]},{"category":"compactness","summary":"Public keys are claimed no more than 84% of comparable ML-KEM keys, with a smaller ciphertext at 256-bit security.","claim_strength":"quantified","comparison_scope":"ML-KEM at matched security levels","source_refs":["spec"]},{"category":"performance","summary":"Public-key compression is claimed to add at most 5% encapsulation/decapsulation time while replacing noise sampling with compression.","claim_strength":"quantified","comparison_scope":"Uncompressed/MLWE-style workflow","source_refs":["spec"]},{"category":"simplicity","summary":"Design uses the LP paradigm, QFO and basic NTT/modular/hash operations.","claim_strength":"qualitative","comparison_scope":null,"source_refs":["spec"]},{"category":"flexibility","summary":"Integer-only polynomial operations are claimed suitable for parallel software and hardware trade-offs.","claim_strength":"qualitative","comparison_scope":null,"source_refs":["spec"]}],"limitations_and_constraints":[{"type":"explicit_caveat","summary":"Compressed public keys must be NTT-transformed during encapsulation and decapsulation, adding claimed time overhead up to 5%.","source_refs":["spec"]},{"type":"explicit_in_submission","summary":"All parameter sets have nonzero DFR and the proposal bounds decapsulation calls by 2^80.","source_refs":["spec"]},{"type":"derived_from_implementation_description","summary":"Optimized implementation targets AVX2; proposed FPGA/RISC-V acceleration is future work, not submitted evidence.","source_refs":["spec"]}]},
  "independent_assessment":{"status":"not_started","findings":[]},"implementations":[{"name":"Reference_Implementation","language":"C","platform":"portable ANSI C","path":"KeyEncapsulation/COMPASS-KEM/Implementations and Test_Vectors/Implementations/Reference_Implementation"},{"name":"Optimized_Implementation","language":"C/intrinsics","platform":"x86-64 AVX2","path":"KeyEncapsulation/COMPASS-KEM/Implementations and Test_Vectors/Implementations/Optimized_Implementation"}],"submission_completeness":{"basic_information":true,"specification":true,"implementation":true,"test_vectors":true},
  "sources":[{"source_id":"basic","type":"basic_information","path":"KeyEncapsulation/COMPASS-KEM/Basic information/COMPASS-KEM算法信息(en).pdf","priority":1,"notes":"Scanned form plus supplement; contacts excluded."},{"source_id":"spec","type":"specification","path":"KeyEncapsulation/COMPASS-KEM/Algorithm specifications/COMPASS-KEM算法文本(en).pdf","priority":2,"notes":null}],
  "evidence":[{"field":"name, version, submitters, affiliations","source_id":"basic","locator":"PDF pp.1-3","summary":"Form and supplement list nine submitters and contact Geng Wang.","confidence":"high"},{"field":"overview_classification, technical_classification","source_id":"spec","locator":"PDF pp.1,4-5,15-20","summary":"Specification identifies prime-modulus MLWR/biased MLWR, ring, COMPASS-PKE, QFO and ROM/QROM claims.","confidence":"high"},{"field":"parameter_sets","source_id":"spec","locator":"PDF pp.18-19, Tables 1-3","summary":"Core parameters, object sizes and DFR are tabulated.","confidence":"high"},{"field":"submission_claims","source_id":"spec","locator":"PDF pp.4,25-27","summary":"Compactness, overhead, simplicity, flexibility and implementation claims are stated.","confidence":"high"}],
  "review":{"extraction_status":"complete","confidence":"high","cross_reviewed":false,"review_notes":["Shared-secret bytes are derived directly from pseudocode output K in B^(n/8)."]},"issues":[]
}
