{
  "schema_version":"1.0.0","algorithm_id":"bra","name":"BRA","full_name":"Blockwise RQC with the AG Codes","version":null,"function":"key_encapsulation","submission_path":"KeyEncapsulation/BRA",
  "overview_classification":{"family":"code_based","family_label_zh":"编码密码","family_report_label":"编码密码","subcategory":"rank_metric","subcategory_label_zh":"基于秩距离","subcategory_report_label":"基于秩距离"},
  "technical_classification":{"hardness_problems":[{"name":"ideal blockwise rank syndrome decoding (IBRSD)","role":"primary","notes":"Two IBRSD assumptions used in tight reductions."},{"name":"blockwise rank decoding (BRD)","role":"secondary","notes":"Sum-rank/blockwise decoding foundation."}],"mathematical_structure":"R=F_(2^m)[X]/(P(X)), ideal codes, blockwise errors and augmented Gabidulin auxiliary codes","underlying_pke":"BRA.PKE","kem_construction":"salted Fujisaki-Okamoto transform","claimed_security_target":"IND-CCA2; 128/256/512-bit classical categories","security_models":["ROM","QROM"]},
  "affiliations":[{"affiliation_id":"aff-nuaa","name_en":"Nanjing University of Aeronautics and Astronautics","name_zh":"南京航空航天大学"},{"affiliation_id":"aff-nudt","name_en":"National University of Defense Technology","name_zh":"国防科技大学"},{"affiliation_id":"aff-sklc","name_en":"State Key Laboratory of Cryptology","name_zh":"密码科学技术国家重点实验室"},{"affiliation_id":"aff-whu","name_en":"Wuhan University","name_zh":"武汉大学"},{"affiliation_id":"aff-xdu","name_en":"Xidian University","name_zh":"西安电子科技大学"},{"affiliation_id":"aff-jnu","name_en":"Jinan University","name_zh":"暨南大学"}],
  "submitters":[{"name_en":"Xinyi Huang","name_zh":"黄欣沂","affiliation_ids":["aff-nuaa"],"roles":["submitter"]},{"name_en":"Yongcheng Song","name_zh":"宋永成","affiliation_ids":["aff-nuaa"],"roles":["submitter","contact"]},{"name_en":"Rongmao Chen","name_zh":"陈荣茂","affiliation_ids":["aff-nudt"],"roles":["submitter"]},{"name_en":"Jiang Zhang","name_zh":"张江","affiliation_ids":["aff-sklc"],"roles":["submitter"]},{"name_en":"Debiao He","name_zh":"何德彪","affiliation_ids":["aff-whu"],"roles":["submitter"]},{"name_en":"Xiaofeng Chen","name_zh":"陈晓峰","affiliation_ids":["aff-xdu"],"roles":["submitter"]},{"name_en":"Junzuo Lai","name_zh":"赖俊佐","affiliation_ids":["aff-jnu"],"roles":["submitter"]},{"name_en":"Yi Wang","name_zh":"王毅","affiliation_ids":["aff-nudt"],"roles":["submitter"]},{"name_en":"Chao Lin","name_zh":"林超","affiliation_ids":["aff-nuaa"],"roles":["submitter"]},{"name_en":"Jiang Tan","name_zh":"谭疆","affiliation_ids":["aff-nudt"],"roles":["submitter"]},{"name_en":"Kang Lin","name_zh":"林康","affiliation_ids":["aff-nudt"],"roles":["submitter"]}],
  "common_parameters":{"ring":"F_(2^m)[X]/(P(X))","field":"F_(2^m)","code_structure":"ideal blockwise rank-metric code with augmented Gabidulin code","isogeny_structure":null,"noise_or_error_distribution":"blockwise/sum-rank errors with direct-sum supports","modulus":2,"dimensions":{"m":"extension degree","n":"ideal-code length","k":"message dimension","t":"generator weight"},"weights":{"w_x":"secret x","w_y":"secret y","w_r1":"encryption r1","w_r2":"encryption r2","w_e":"error e"},"error_correction":{"code":"augmented Gabidulin","decoder":"Welch-Berlekamp-like (WBL)","radius":"r"},"symmetric_primitives":["NGCC SM3 DRBG","SM3/HMAC-SM3 pseudohash with 64-byte output"],"representation":"seeded private key; finite-field vectors and sparse irreducible P(X)","other":{"hash_query_bound":"2^64"}},
  "parameter_sets":[
    {"name":"BRA-128","implementation_aliases":[],"submission_security_label":"128-bit classical / 80-bit quantum target","claimed_classical_security_bits":189,"claimed_quantum_security_bits":94,"core_parameters":{"q":2,"m":67,"n":121,"t":67,"k":4,"w_x":4,"w_y":5,"w_r1":5,"w_r2":5,"w_e":8,"r":53,"P":"X^121+X^18+1"},"decapsulation_failure_probability":"2^-130","sizes":{"public_key":{"bytes":1078,"raw":"1078 bytes","basis":"specification Table 3"},"secret_key":{"bytes":98,"raw":"98 bytes","basis":"specification Table 3"},"ciphertext":{"bytes":2092,"raw":"2092 bytes","basis":"specification Table 3"},"shared_secret":{"bytes":64,"raw":"64 bytes","basis":"specification Table 3"}},"source_refs":["spec"],"issues":[]},
    {"name":"BRA-256","implementation_aliases":[],"submission_security_label":"256-bit classical / 128-bit quantum target","claimed_classical_security_bits":304,"claimed_quantum_security_bits":152,"core_parameters":{"q":2,"m":83,"n":161,"t":83,"k":4,"w_x":5,"w_y":5,"w_r1":6,"w_r2":6,"w_e":8,"r":68,"P":"X^161+X^18+1"},"decapsulation_failure_probability":"2^-262","sizes":{"public_key":{"bytes":1735,"raw":"1735 bytes","basis":"specification Table 3"},"secret_key":{"bytes":106,"raw":"106 bytes","basis":"specification Table 3"},"ciphertext":{"bytes":3406,"raw":"3406 bytes","basis":"specification Table 3"},"shared_secret":{"bytes":64,"raw":"64 bytes","basis":"specification Table 3"}},"source_refs":["spec"],"issues":[]},
    {"name":"BRA-512","implementation_aliases":[],"submission_security_label":"512-bit classical / 256-bit quantum target","claimed_classical_security_bits":556,"claimed_quantum_security_bits":278,"core_parameters":{"q":2,"m":127,"n":221,"t":127,"k":5,"w_x":6,"w_y":6,"w_r1":7,"w_r2":8,"w_e":8,"r":98,"P":"X^221+X^8+X^6+X^2+1"},"decapsulation_failure_probability":"2^-523","sizes":{"public_key":{"bytes":3573,"raw":"3573 bytes","basis":"specification Table 3"},"secret_key":{"bytes":144,"raw":"144 bytes","basis":"specification Table 3"},"ciphertext":{"bytes":7082,"raw":"7082 bytes","basis":"specification Table 3"},"shared_secret":{"bytes":64,"raw":"64 bytes","basis":"specification Table 3"}},"source_refs":["spec"],"issues":[]}
  ],
  "submission_claims":{"claimed_advantages":[{"category":"security","summary":"Security is claimed to reduce to syndrome decoding without hidden-code-structure recovery assumptions.","claim_strength":"qualitative","comparison_scope":"Structured-code attacks","source_refs":["spec"]},{"category":"compactness","summary":"Blockwise errors and augmented Gabidulin codes are claimed to reduce key and ciphertext sizes relative to conventional rank-metric designs.","claim_strength":"comparative","comparison_scope":"Rank- and Hamming-metric KEMs","source_refs":["spec"]},{"category":"security","summary":"The submission claims precise DFR estimates for all recommended sets.","claim_strength":"quantified","comparison_scope":null,"source_refs":["spec"]},{"category":"flexibility","summary":"Construction is described as clean, clear and flexible.","claim_strength":"qualitative","comparison_scope":null,"source_refs":["spec"]}],"limitations_and_constraints":[{"type":"explicit_caveat","summary":"Rank-metric cryptography is comparatively young and continuing cryptanalysis is needed.","source_refs":["spec"]},{"type":"explicit_caveat","summary":"Augmented Gabidulin decoding/properties are recent and their special structure requires further security analysis.","source_refs":["spec"]},{"type":"explicit_caveat","summary":"No known search-to-decision reduction is available for IBRD.","source_refs":["spec"]},{"type":"derived_from_test_setup","summary":"Benchmarks were run in WSL2 Ubuntu 26.04 on one Intel Core Ultra 9 275HX performance core with specified instruction extensions.","source_refs":["spec"]}]},
  "independent_assessment":{"status":"not_started","findings":[]},"implementations":[{"name":"Reference_Implementation","language":"C/C++","platform":"WSL2/Linux","path":"KeyEncapsulation/BRA/Implementations/Reference_Implementation"},{"name":"Optimized_Implementation","language":"C/C++","platform":"x86-64 AVX2/AVX-VNNI","path":"KeyEncapsulation/BRA/Implementations/Optimized_Implementation"}],"submission_completeness":{"basic_information":true,"specification":true,"implementation":true,"test_vectors":true},
  "sources":[{"source_id":"basic","type":"basic_information","path":"KeyEncapsulation/BRA/Basic information/BRA-Basic Algorithm Information.pdf","priority":1,"notes":"Scanned form; contacts excluded."},{"source_id":"spec","type":"specification","path":"KeyEncapsulation/BRA/Algorithm specifications/BRA-Documentation.pdf","priority":2,"notes":null}],
  "evidence":[{"field":"submitters, affiliations","source_id":"basic","locator":"PDF pp.1-3","summary":"Basic form lists 11 submitters and contact Yongcheng Song.","confidence":"high"},{"field":"overview_classification, technical_classification","source_id":"spec","locator":"PDF pp.1,3-8,16,18-20","summary":"Rank-metric blockwise assumptions, AG code, PKE and salted FO are defined.","confidence":"high"},{"field":"parameter_sets","source_id":"spec","locator":"PDF pp.16-17, Tables 2-3","summary":"Core parameters, sizes, DFR and security estimates are tabulated.","confidence":"high"},{"field":"submission_claims","source_id":"spec","locator":"PDF p.31","summary":"Advantages and three explicit limitations are listed.","confidence":"high"}],
  "review":{"extraction_status":"complete","confidence":"high","cross_reviewed":false,"review_notes":["Security-bit fields use the table's classical/quantum attack estimates rather than category labels."]},"issues":[{"severity":"missing","code":"version_not_stated","message":"No explicit version string located.","field":"version"}]
}
