{
  "schema_version":"1.0.0","algorithm_id":"bag-loong","name":"BAG-Loong","full_name":"Loong with Blended-block Errors and Augmented Gabidulin Codes","version":null,"function":"key_encapsulation","submission_path":"KeyEncapsulation/BAG-Loong",
  "overview_classification":{"family":"code_based","family_label_zh":"编码密码","family_report_label":"编码密码","subcategory":"rank_metric","subcategory_label_zh":"基于秩距离","subcategory_report_label":"基于秩距离"},
  "technical_classification":{"hardness_problems":[{"name":"blended-block rank decoding (l-BRD)","role":"primary","notes":"Unstructured rank-metric decoding with blended-block errors."},{"name":"blended-block rank syndrome decoding (l-BRSD)","role":"primary","notes":"Dual formulation used in security analysis."}],"mathematical_structure":"Unstructured linear codes over F_(2^m), blended-block rank errors, augmented Gabidulin auxiliary code","underlying_pke":"BAG-Loong.PKE","kem_construction":"salted Fujisaki-Okamoto (SFO) transform","claimed_security_target":"IND-CCA2; 128/256/384/512-bit classical targets and 80/128/192/256-bit quantum targets","security_models":["ROM"]},
  "affiliations":[{"affiliation_id":"aff-iie-cas","name_en":"Institute of Information Engineering, Chinese Academy of Sciences","name_zh":"中国科学院信息工程研究所"},{"affiliation_id":"aff-ntu","name_en":"Nanyang Technological University","name_zh":"南洋理工大学"}],
  "submitters":[{"name_en":"Li-Ping Wang","name_zh":"王丽萍","affiliation_ids":["aff-iie-cas"],"roles":["submitter"]},{"name_en":"Haofei Wang","name_zh":"王浩飞","affiliation_ids":["aff-iie-cas"],"roles":["submitter"]},{"name_en":"Buchan Liu","name_zh":"刘步蟾","affiliation_ids":["aff-iie-cas"],"roles":["submitter"]},{"name_en":"Peirong Li","name_zh":"李沛荣","affiliation_ids":["aff-iie-cas"],"roles":["submitter"]},{"name_en":"Huaxiong Wang","name_zh":"王华雄","affiliation_ids":["aff-ntu"],"roles":["submitter"]},{"name_en":"Liang Fan","name_zh":"樊亮","affiliation_ids":["aff-iie-cas"],"roles":["contact"]}],
  "common_parameters":{"ring":null,"field":"F_(2^m)","code_structure":"unstructured rank-metric linear code with augmented Gabidulin code G+(n1*n2,n',k,m)","isogeny_structure":null,"noise_or_error_distribution":"blended-block errors sampled from partially joint supports","modulus":2,"dimensions":{"n":"parameter-set-specific","m":"extension degree","n1":"block dimension","n2":"syndrome multiplicity"},"weights":{"A_xy":"rank-weight matrix","A_R1_E_R2":"encryption-error rank-weight matrix"},"error_correction":"iterative decoder for augmented Gabidulin codes","symmetric_primitives":["SHAKE256","SHA3-512"],"representation":"finite-field matrices; public matrix regenerated from seed","other":{"salted_fo":true}},
  "parameter_sets":[
    {"name":"BAG-Loong-128","implementation_aliases":[],"submission_security_label":"128-bit classical / 80-bit quantum","claimed_classical_security_bits":128,"claimed_quantum_security_bits":80,"core_parameters":{"n":42,"m":47,"n_prime":46,"n1":10,"n2":10,"epsilon":33,"k":3,"A_xy":[[5,4],[4,5]],"A_R1_E_R2":[[5,3],[3,5]],"field_polynomial":"X^47+X^5+1"},"decapsulation_failure_probability":"2^-130","sizes":{"public_key":{"bytes":2500,"raw":"2500 bytes","basis":"specification Table 3"},"secret_key":{"bytes":16,"raw":"seed size 16 bytes","basis":"specification Table 3 and seeded-key description"},"ciphertext":{"bytes":3055,"raw":"3055 bytes","basis":"specification Table 3"},"shared_secret":{"bytes":16,"raw":"16 bytes","basis":"specification Table 3"}},"source_refs":["spec"],"issues":[]},
    {"name":"BAG-Loong-256","implementation_aliases":[],"submission_security_label":"256-bit classical / 128-bit quantum","claimed_classical_security_bits":256,"claimed_quantum_security_bits":128,"core_parameters":{"n":65,"m":67,"n_prime":67,"n1":12,"n2":13,"epsilon":51,"k":4,"A_xy":[[5,3],[3,6]],"A_R1_E_R2":[[6,3],[3,6]],"field_polynomial":"X^67+X^5+X^2+X+1"},"decapsulation_failure_probability":"2^-271","sizes":{"public_key":{"bytes":6597,"raw":"6597 bytes","basis":"specification Table 3"},"secret_key":{"bytes":32,"raw":"seed size 32 bytes","basis":"specification Table 3 and seeded-key description"},"ciphertext":{"bytes":8384,"raw":"8384 bytes","basis":"specification Table 3"},"shared_secret":{"bytes":32,"raw":"32 bytes","basis":"specification Table 3"}},"source_refs":["spec"],"issues":["Security-analysis Table 5 mislabels this and subsequent rows as BAG-Piglet; values retained under BAG-Loong because table caption and section are BAG-Loong."]},
    {"name":"BAG-Loong-384","implementation_aliases":[],"submission_security_label":"384-bit classical / 192-bit quantum","claimed_classical_security_bits":384,"claimed_quantum_security_bits":192,"core_parameters":{"n":83,"m":83,"n_prime":83,"n1":14,"n2":15,"epsilon":66,"k":5,"A_xy":[[6,3],[3,6]],"A_R1_E_R2":[[7,4],[4,7]],"field_polynomial":"X^83+X^7+X^4+X^2+1"},"decapsulation_failure_probability":"2^-432","sizes":{"public_key":{"bytes":12152,"raw":"12152 bytes","basis":"specification Table 3"},"secret_key":{"bytes":48,"raw":"seed size 48 bytes","basis":"specification Table 3 and seeded-key description"},"ciphertext":{"bytes":15096,"raw":"15096 bytes","basis":"specification Table 3"},"shared_secret":{"bytes":48,"raw":"48 bytes","basis":"specification Table 3"}},"source_refs":["spec"],"issues":["Security-analysis Table 5 row label is BAG-Piglet-384; treated as an editorial error."]},
    {"name":"BAG-Loong-512","implementation_aliases":[],"submission_security_label":"512-bit classical / 256-bit quantum","claimed_classical_security_bits":512,"claimed_quantum_security_bits":256,"core_parameters":{"n":104,"m":97,"n_prime":97,"n1":15,"n2":15,"epsilon":73,"k":6,"A_xy":[[7,4],[4,7]],"A_R1_E_R2":[[7,4],[4,7]],"field_polynomial":"X^104+X^4+X^3+X+1"},"decapsulation_failure_probability":"2^-558","sizes":{"public_key":{"bytes":19043,"raw":"19043 bytes","basis":"specification Table 3"},"secret_key":{"bytes":64,"raw":"seed size 64 bytes","basis":"specification Table 3 and seeded-key description"},"ciphertext":{"bytes":21644,"raw":"21644 bytes","basis":"specification Table 3"},"shared_secret":{"bytes":64,"raw":"64 bytes","basis":"specification Table 3"}},"source_refs":["spec"],"issues":["Security-analysis Table 5 row label is BAG-Piglet-512; treated as an editorial error."]}
  ],
  "submission_claims":{"claimed_advantages":[{"category":"security","summary":"The public key is claimed to have no algebraic structure and security is based on unstructured rank-decoding problems.","claim_strength":"qualitative","comparison_scope":"Structured rank-metric systems","source_refs":["spec"]},{"category":"compactness","summary":"Blended-block errors and augmented-Gabidulin multiple syndromes are claimed to permit compact, flexible parameters.","claim_strength":"comparative","comparison_scope":"Loong, Multi-UR-AG and LRPC-MS","source_refs":["spec"]},{"category":"performance","summary":"A new iterative augmented-Gabidulin decoder is claimed to improve decoding performance.","claim_strength":"qualitative","comparison_scope":"Prior augmented-Gabidulin decoding","source_refs":["spec"]}],"limitations_and_constraints":[{"type":"explicit_in_submission","summary":"All parameter sets have nonzero DFR, ranging from 2^-130 to 2^-558.","source_refs":["spec"]},{"type":"derived_from_test_setup","summary":"Reported reference performance averages 1000 random instances and uses finite-field arithmetic libraries.","source_refs":["spec"]}]},
  "independent_assessment":{"status":"not_started","findings":[]},"implementations":[{"name":"Reference_Implementation","language":"C++","platform":"Linux with NTL","path":"KeyEncapsulation/BAG-Loong/Implementations/Reference_Implementation"},{"name":"Optimized_Implementation","language":"C++","platform":"Linux with NTL","path":"KeyEncapsulation/BAG-Loong/Implementations/Optimized_Implementation"}],"submission_completeness":{"basic_information":true,"specification":true,"implementation":true,"test_vectors":true},
  "sources":[{"source_id":"basic","type":"basic_information","path":"KeyEncapsulation/BAG-Loong/Basic information/Basic information.pdf","priority":1,"notes":"Scanned form; OCR and visual review used; personal contacts excluded."},{"source_id":"spec","type":"specification","path":"KeyEncapsulation/BAG-Loong/Algorithm specifications/Algorithm specifications.pdf","priority":2,"notes":null}],
  "evidence":[{"field":"submitters, affiliations","source_id":"basic","locator":"PDF pp.1-2","summary":"Form lists five submitters and one contact.","confidence":"high"},{"field":"overview_classification, technical_classification","source_id":"spec","locator":"PDF pp.3,6-8,10-12","summary":"Document explicitly defines unstructured rank-metric construction, blended-block assumptions, SFO and AG code.","confidence":"high"},{"field":"parameter_sets","source_id":"spec","locator":"PDF p.8, Tables 1-3; p.22, Table 5","summary":"Core parameters, sizes and DFR values are tabulated.","confidence":"medium"},{"field":"submission_claims","source_id":"spec","locator":"PDF pp.24-25","summary":"Advantages and named comparison schemes are stated.","confidence":"high"}],
  "review":{"extraction_status":"partial","confidence":"medium","cross_reviewed":false,"review_notes":["Table 5 row-label inconsistency retained as an issue rather than silently corrected."]},"issues":[{"severity":"conflict","code":"table5_row_labels","message":"BAG-Loong security Table 5 labels the 256/384/512 rows as BAG-Piglet despite BAG-Loong caption and context.","field":"parameter_sets[*].decapsulation_failure_probability"},{"severity":"missing","code":"version_not_stated","message":"No explicit version string located.","field":"version"}]
}
